3b:00.0 3D controller: NVIDIA Corporation GV100GL [Tesla V100 PCIe 16GB] (rev a1)
	Subsystem: NVIDIA Corporation GV100GL [Tesla V100 PCIe 16GB]
	Control: I/O- Mem+ BusMaster+ SpecCycle- MemWINV- VGASnoop- ParErr- Stepping- SERR+ FastB2B- DisINTx+
	Status: Cap+ 66MHz- UDF- FastB2B- ParErr- DEVSEL=fast >TAbort- <TAbort- <MAbort- >SERR- <PERR- INTx-
	Latency: 0
	Interrupt: pin A routed to IRQ 142
	NUMA node: 0
	Region 0: Memory at b7000000 (32-bit, non-prefetchable) [size=16M]
	Region 1: Memory at 38b800000000 (64-bit, prefetchable) [size=16G]
	Region 3: Memory at 38bc00000000 (64-bit, prefetchable) [size=32M]
	Capabilities: <access denied>
	Kernel driver in use: nvidia
	Kernel modules: nvidiafb, nouveau, nvidia_drm, nvidia

5d:00.0 PCI bridge: Intel Corporation Sky Lake-E PCI Express Root Port A (rev 04) (prog-if 00 [Normal decode])
	Physical Slot: 9
	Control: I/O+ Mem+ BusMaster+ SpecCycle- MemWINV- VGASnoop- ParErr+ Stepping- SERR+ FastB2B- DisINTx+
	Status: Cap+ 66MHz- UDF- FastB2B- ParErr- DEVSEL=fast >TAbort- <TAbort- <MAbort- >SERR- <PERR- INTx-
	Latency: 0, Cache Line Size: 64 bytes
	Interrupt: pin A routed to IRQ 31
	NUMA node: 0
	Bus: primary=5d, secondary=5e, subordinate=5e, sec-latency=0
	I/O behind bridge: [disabled]
	Memory behind bridge: c4000000-c4ffffff [size=16M]
	Prefetchable memory behind bridge: 000038f800000000-000038fc01ffffff [size=16416M]
	Secondary status: 66MHz- FastB2B- ParErr- DEVSEL=fast >TAbort- <TAbort- <MAbort+ <SERR- <PERR-
	BridgeCtl: Parity+ SERR+ NoISA- VGA- VGA16+ MAbort- >Reset- FastB2B-
		PriDiscTmr- SecDiscTmr- DiscTmrStat- DiscTmrSERREn-
	Capabilities: <access denied>
	Kernel driver in use: pcieport

5d:05.0 System peripheral: Intel Corporation Sky Lake-E VT-d (rev 04)
	Subsystem: Intel Corporation Sky Lake-E VT-d
	Control: I/O- Mem- BusMaster- SpecCycle- MemWINV- VGASnoop- ParErr- Stepping- SERR- FastB2B- DisINTx-
	Status: Cap+ 66MHz- UDF- FastB2B- ParErr- DEVSEL=fast >TAbort- <TAbort- <MAbort- >SERR- <PERR- INTx-
	NUMA node: 0
	Capabilities: <access denied>

5d:05.2 System peripheral: Intel Corporation Sky Lake-E RAS Configuration Registers (rev 04)
	Control: I/O- Mem- BusMaster- SpecCycle- MemWINV- VGASnoop- ParErr- Stepping- SERR- FastB2B- DisINTx-
	Status: Cap+ 66MHz- UDF- FastB2B- ParErr- DEVSEL=fast >TAbort- <TAbort- <MAbort- >SERR- <PERR- INTx-
	NUMA node: 0
	Capabilities: <access denied>

5d:05.4 PIC: Intel Corporation Sky Lake-E IOxAPIC Configuration Registers (rev 04) (prog-if 20 [IO(X)-APIC])
	Subsystem: Intel Corporation Sky Lake-E IOxAPIC Configuration Registers
	Control: I/O- Mem+ BusMaster+ SpecCycle- MemWINV- VGASnoop- ParErr- Stepping- SERR- FastB2B- DisINTx-
	Status: Cap+ 66MHz- UDF- FastB2B- ParErr- DEVSEL=fast >TAbort- <TAbort- <MAbort- >SERR- <PERR- INTx-
	Latency: 0, Cache Line Size: 64 bytes
	NUMA node: 0
	Region 0: Memory at c5000000 (32-bit, non-prefetchable) [size=4K]
	Capabilities: <access denied>
--
5e:00.0 3D controller: NVIDIA Corporation GV100GL [Tesla V100 PCIe 16GB] (rev a1)
	Subsystem: NVIDIA Corporation GV100GL [Tesla V100 PCIe 16GB]
	Control: I/O- Mem+ BusMaster+ SpecCycle- MemWINV- VGASnoop- ParErr- Stepping- SERR+ FastB2B- DisINTx+
	Status: Cap+ 66MHz- UDF- FastB2B- ParErr- DEVSEL=fast >TAbort- <TAbort- <MAbort- >SERR- <PERR- INTx-
	Latency: 0
	Interrupt: pin A routed to IRQ 143
	NUMA node: 0
	Region 0: Memory at c4000000 (32-bit, non-prefetchable) [size=16M]
	Region 1: Memory at 38f800000000 (64-bit, prefetchable) [size=16G]
	Region 3: Memory at 38fc00000000 (64-bit, prefetchable) [size=32M]
	Capabilities: <access denied>
	Kernel driver in use: nvidia
	Kernel modules: nvidiafb, nouveau, nvidia_drm, nvidia

80:04.0 System peripheral: Intel Corporation Sky Lake-E CBDMA Registers (rev 04)
	Subsystem: Intel Corporation Sky Lake-E CBDMA Registers
	Control: I/O- Mem+ BusMaster+ SpecCycle- MemWINV- VGASnoop- ParErr- Stepping- SERR- FastB2B- DisINTx+
	Status: Cap+ 66MHz- UDF- FastB2B- ParErr- DEVSEL=fast >TAbort- <TAbort- <MAbort- >SERR- <PERR- INTx-
	Latency: 0, Cache Line Size: 64 bytes
	Interrupt: pin A routed to IRQ 128
	NUMA node: 1
	Region 0: Memory at 393ffff1c000 (64-bit, non-prefetchable) [size=16K]
	Capabilities: <access denied>
	Kernel driver in use: ioatdma
	Kernel modules: ioatdma

80:04.1 System peripheral: Intel Corporation Sky Lake-E CBDMA Registers (rev 04)
	Subsystem: Intel Corporation Sky Lake-E CBDMA Registers
	Control: I/O- Mem+ BusMaster+ SpecCycle- MemWINV- VGASnoop- ParErr- Stepping- SERR- FastB2B- DisINTx+
	Status: Cap+ 66MHz- UDF- FastB2B- ParErr- DEVSEL=fast >TAbort- <TAbort- <MAbort- >SERR- <PERR- INTx-
	Latency: 0, Cache Line Size: 64 bytes
	Interrupt: pin B routed to IRQ 130
	NUMA node: 1
	Region 0: Memory at 393ffff18000 (64-bit, non-prefetchable) [size=16K]
	Capabilities: <access denied>
	Kernel driver in use: ioatdma
	Kernel modules: ioatdma

80:04.2 System peripheral: Intel Corporation Sky Lake-E CBDMA Registers (rev 04)
	Subsystem: Intel Corporation Sky Lake-E CBDMA Registers
	Control: I/O- Mem+ BusMaster+ SpecCycle- MemWINV- VGASnoop- ParErr- Stepping- SERR- FastB2B- DisINTx+
	Status: Cap+ 66MHz- UDF- FastB2B- ParErr- DEVSEL=fast >TAbort- <TAbort- <MAbort- >SERR- <PERR- INTx-
	Latency: 0, Cache Line Size: 64 bytes
	Interrupt: pin C routed to IRQ 128
	NUMA node: 1
	Region 0: Memory at 393ffff14000 (64-bit, non-prefetchable) [size=16K]
	Capabilities: <access denied>
	Kernel driver in use: ioatdma
	Kernel modules: ioatdma

80:04.3 System peripheral: Intel Corporation Sky Lake-E CBDMA Registers (rev 04)
	Subsystem: Intel Corporation Sky Lake-E CBDMA Registers
--
86:00.0 3D controller: NVIDIA Corporation GV100GL [Tesla V100 PCIe 16GB] (rev a1)
	Subsystem: NVIDIA Corporation GV100GL [Tesla V100 PCIe 16GB]
	Control: I/O- Mem+ BusMaster+ SpecCycle- MemWINV- VGASnoop- ParErr- Stepping- SERR+ FastB2B- DisINTx+
	Status: Cap+ 66MHz- UDF- FastB2B- ParErr- DEVSEL=fast >TAbort- <TAbort- <MAbort- >SERR- <PERR- INTx-
	Latency: 0
	Interrupt: pin A routed to IRQ 144
	NUMA node: 1
	Region 0: Memory at df000000 (32-bit, non-prefetchable) [size=16M]
	Region 1: Memory at 397800000000 (64-bit, prefetchable) [size=16G]
	Region 3: Memory at 397c00000000 (64-bit, prefetchable) [size=32M]
	Capabilities: <access denied>
	Kernel driver in use: nvidia
	Kernel modules: nvidiafb, nouveau, nvidia_drm, nvidia

ae:00.0 PCI bridge: Intel Corporation Sky Lake-E PCI Express Root Port A (rev 04) (prog-if 00 [Normal decode])
	Physical Slot: 26
	Control: I/O+ Mem+ BusMaster+ SpecCycle- MemWINV- VGASnoop- ParErr+ Stepping- SERR+ FastB2B- DisINTx+
	Status: Cap+ 66MHz- UDF- FastB2B- ParErr- DEVSEL=fast >TAbort- <TAbort- <MAbort- >SERR- <PERR- INTx-
	Latency: 0, Cache Line Size: 64 bytes
	Interrupt: pin A routed to IRQ 35
	NUMA node: 1
	Bus: primary=ae, secondary=af, subordinate=af, sec-latency=0
	I/O behind bridge: [disabled]
	Memory behind bridge: ed000000-edffffff [size=16M]
	Prefetchable memory behind bridge: 000039b800000000-000039bc01ffffff [size=16416M]
	Secondary status: 66MHz- FastB2B- ParErr- DEVSEL=fast >TAbort- <TAbort- <MAbort+ <SERR- <PERR-
	BridgeCtl: Parity+ SERR+ NoISA- VGA- VGA16+ MAbort- >Reset- FastB2B-
		PriDiscTmr- SecDiscTmr- DiscTmrStat- DiscTmrSERREn-
	Capabilities: <access denied>
	Kernel driver in use: pcieport

ae:05.0 System peripheral: Intel Corporation Sky Lake-E VT-d (rev 04)
	Subsystem: Intel Corporation Sky Lake-E VT-d
	Control: I/O- Mem- BusMaster- SpecCycle- MemWINV- VGASnoop- ParErr- Stepping- SERR- FastB2B- DisINTx-
	Status: Cap+ 66MHz- UDF- FastB2B- ParErr- DEVSEL=fast >TAbort- <TAbort- <MAbort- >SERR- <PERR- INTx-
	NUMA node: 1
	Capabilities: <access denied>

ae:05.2 System peripheral: Intel Corporation Sky Lake-E RAS Configuration Registers (rev 04)
	Control: I/O- Mem- BusMaster- SpecCycle- MemWINV- VGASnoop- ParErr- Stepping- SERR- FastB2B- DisINTx-
	Status: Cap+ 66MHz- UDF- FastB2B- ParErr- DEVSEL=fast >TAbort- <TAbort- <MAbort- >SERR- <PERR- INTx-
	NUMA node: 1
	Capabilities: <access denied>

ae:05.4 PIC: Intel Corporation Sky Lake-E IOxAPIC Configuration Registers (rev 04) (prog-if 20 [IO(X)-APIC])
	Subsystem: Intel Corporation Sky Lake-E IOxAPIC Configuration Registers
	Control: I/O- Mem+ BusMaster+ SpecCycle- MemWINV- VGASnoop- ParErr- Stepping- SERR- FastB2B- DisINTx-
	Status: Cap+ 66MHz- UDF- FastB2B- ParErr- DEVSEL=fast >TAbort- <TAbort- <MAbort- >SERR- <PERR- INTx-
	Latency: 0, Cache Line Size: 64 bytes
	NUMA node: 1
	Region 0: Memory at ee000000 (32-bit, non-prefetchable) [size=4K]
	Capabilities: <access denied>
--
af:00.0 3D controller: NVIDIA Corporation GV100GL [Tesla V100 PCIe 16GB] (rev a1)
	Subsystem: NVIDIA Corporation GV100GL [Tesla V100 PCIe 16GB]
	Control: I/O- Mem+ BusMaster+ SpecCycle- MemWINV- VGASnoop- ParErr- Stepping- SERR+ FastB2B- DisINTx+
	Status: Cap+ 66MHz- UDF- FastB2B- ParErr- DEVSEL=fast >TAbort- <TAbort- <MAbort- >SERR- <PERR- INTx-
	Latency: 0
	Interrupt: pin A routed to IRQ 145
	NUMA node: 1
	Region 0: Memory at ed000000 (32-bit, non-prefetchable) [size=16M]
	Region 1: Memory at 39b800000000 (64-bit, prefetchable) [size=16G]
	Region 3: Memory at 39bc00000000 (64-bit, prefetchable) [size=32M]
	Capabilities: <access denied>
	Kernel driver in use: nvidia
	Kernel modules: nvidiafb, nouveau, nvidia_drm, nvidia

d7:00.0 PCI bridge: Intel Corporation Sky Lake-E PCI Express Root Port A (rev 04) (prog-if 00 [Normal decode])
	Physical Slot: 30
	Control: I/O+ Mem+ BusMaster+ SpecCycle- MemWINV- VGASnoop- ParErr+ Stepping- SERR+ FastB2B- DisINTx+
	Status: Cap+ 66MHz- UDF- FastB2B- ParErr- DEVSEL=fast >TAbort- <TAbort- <MAbort- >SERR- <PERR- INTx-
	Latency: 0, Cache Line Size: 64 bytes
	Interrupt: pin A routed to IRQ 37
	NUMA node: 1
	Bus: primary=d7, secondary=d8, subordinate=d8, sec-latency=0
	I/O behind bridge: [disabled]
	Memory behind bridge: fbe00000-fbefffff [size=1M]
	Prefetchable memory behind bridge: 000039fffe000000-000039ffffffffff [size=32M]
	Secondary status: 66MHz- FastB2B- ParErr- DEVSEL=fast >TAbort- <TAbort- <MAbort+ <SERR- <PERR-
	BridgeCtl: Parity+ SERR+ NoISA- VGA- VGA16+ MAbort- >Reset- FastB2B-
		PriDiscTmr- SecDiscTmr- DiscTmrStat- DiscTmrSERREn-
	Capabilities: <access denied>
	Kernel driver in use: pcieport

d7:05.0 System peripheral: Intel Corporation Sky Lake-E VT-d (rev 04)
	Subsystem: Intel Corporation Sky Lake-E VT-d
	Control: I/O- Mem- BusMaster- SpecCycle- MemWINV- VGASnoop- ParErr- Stepping- SERR- FastB2B- DisINTx-
	Status: Cap+ 66MHz- UDF- FastB2B- ParErr- DEVSEL=fast >TAbort- <TAbort- <MAbort- >SERR- <PERR- INTx-
	NUMA node: 1
	Capabilities: <access denied>

d7:05.2 System peripheral: Intel Corporation Sky Lake-E RAS Configuration Registers (rev 04)
	Control: I/O- Mem- BusMaster- SpecCycle- MemWINV- VGASnoop- ParErr- Stepping- SERR- FastB2B- DisINTx-
	Status: Cap+ 66MHz- UDF- FastB2B- ParErr- DEVSEL=fast >TAbort- <TAbort- <MAbort- >SERR- <PERR- INTx-
	NUMA node: 1
	Capabilities: <access denied>

d7:05.4 PIC: Intel Corporation Sky Lake-E IOxAPIC Configuration Registers (rev 04) (prog-if 20 [IO(X)-APIC])
	Subsystem: Intel Corporation Sky Lake-E IOxAPIC Configuration Registers
	Control: I/O- Mem+ BusMaster+ SpecCycle- MemWINV- VGASnoop- ParErr- Stepping- SERR- FastB2B- DisINTx-
	Status: Cap+ 66MHz- UDF- FastB2B- ParErr- DEVSEL=fast >TAbort- <TAbort- <MAbort- >SERR- <PERR- INTx-
	Latency: 0, Cache Line Size: 64 bytes
	NUMA node: 1
	Region 0: Memory at fbf00000 (32-bit, non-prefetchable) [size=4K]
	Capabilities: <access denied>
